,term en,part of spetch en,description en,term ar,description ar,term zh-CN,description zh-CN,term de,description de,term uk,description uk
1,applet,ADJ,A program that is run by an application.,بريمج,برنامج يتم تشغيله من قبل تطبيق ما.,小程序,由应用程序运行的程序。,Applet,"Ein Programm, die von einer Anwendung ausgeführt wird.",аплет,"Програма, яка знаходиться у веденні програми."
2,bootloader,ADJ,Software that boots and loads an operating system. Also allows a user to choose between multiple operating systems - if you have.,محمل الإقلاع,برنامج الأحذية ويقوم بتحميل نظام التشغيل. كما يسمح لمستخدم بالاختيار من بين العديد من أنظمة التشغيل--إذا كان لديك.,引导装载程序,启动并加载操作系统软件。如果你有，还允许用户选择多个操作系统-之间。,Bootloader,"Software, die startet und lädt ein Betriebssystem. Auch ermöglicht einem Benutzer, mehrere Betriebssysteme - Auswahl haben Sie.",завантажувач,"Програмне забезпечення, яке чоботи і завантажує операційної системи. Дозволяє користувачеві вибирати між кількома операційними системами - якщо у вас є."
3,codec,ADJ,"A piece of software design to encode and decode (plays) digital data, especially audio and video streams.",برنامج الترميز,قطعة من تصميم البرمجيات لترميز وفك ترميز البيانات الرقمية (يلعب)، لا سيما الصوت ودفق الفيديو.,编解码器,一块的软件设计，编码和解码 （戏剧） 数字数据，尤其是音频和视频流。,Codec,"Ein Stück Software-Design zu codieren und decodieren (Stücke) digitale Daten, vor allem Audio- und video-Streams.",кодек,"Частина проектування програмного забезпечення для кодування та декодування (п'єси) цифрових даних, особливо для аудіо та відео потоків."
4,directory,ADJ,"A virtual container within a digital file system, in which groups of files and other directories can be kept and organized.",الدليل,حاوية افتراضية ضمن نظام ملفات رقمية، التي يمكن الاحتفاظ بمجموعات من الملفات والدلائل الأخرى وتنظيمها.,目录,数字文件在系统内，可以保持和组织团体的文件和其他目录的虚拟容器。,Verzeichnis,"Ein virtueller Container innerhalb eines digitalen Dateisystems, in dem Gruppen von Dateien und andere Verzeichnisse gehalten und organisiert werden können.",директорія,"Віртуальний контейнера в рамках системи цифрового файлу, в якому групи файлів та інші каталоги можуть зберігатися і організовані."
5,"ext3 (or ""third extended filesystem"")",ADJ,"A popular file system used in many Linux distributions, including Ubuntu. The file system is the operating system's method of categorizing and storing data on physical and network drives. ext3's counterpart in Windows is NTFS (or NT File System).","ext3 (أو ""نظام الملفات الموسعة الثالثة"")",نظام ملفات شعبية المستخدمة في العديد من توزيعات لينكس، بما في ذلك أوبونتو. نظام الملفات هو الأسلوب في نظام التشغيل لتصنيف وتخزين البيانات على البدنية ومحركات أقراص شبكة الاتصال. النظيرة ل ext3 في Windows هو NTFS (أو نظام ملفات NT).,"ext3 （或者""第三个扩展文件系统""）",在许多 Linux 发行版，包括 Ubuntu 中使用流行的文件系统。文件系统是操作系统的方法进行分类和存储数据的物理和网络驱动器。在 Windows 中的 ext3 的对应是 NTFS （或 NT 文件系统）。,"ext3 (oder ""dritte erweiterte Dateisystem"")","Ein beliebtes Dateisystem verwendet in vielen Linux-Distributionen, wie Ubuntu. Das Dateisystem ist das Betriebssystem Methode der Kategorisierung und Speicherung von Daten auf physischen und Netzlaufwerke. ext3 Gegenstück in Windows ist NTFS (oder NT-Dateisystem).","ext3 (або ""третій розширена файлова система"")","Популярні файлова система використовується у багатьох дистрибутивах Linux, у тому числі Ubuntu. Файлова система – операційну систему метод класифікації та зберігання даних на фізичну і мережеві диски. аналог в ext3 у Windows є NTFS (або файлова система NT)."
